{
  "id": "org.mydaw.vocal-preparation",
  "version": "0.2.0",
  "apiVersion": 0,
  "displayName": "Подготовка вокальных дорожек",
  "capabilities": ["project.read", "project.edit", "audio.read.selection", "audio.render.preview"],
  "actions": [
    {"id": "rename-track", "label": "Переименовать дорожку", "uiSlot": "track.context", "operation": "track.rename"},
    {"id": "set-gain", "label": "Уровень дорожки", "uiSlot": "track.context", "operation": "track.setGain"},
    {"id": "prepare-vocals", "label": "Подготовить вокал", "uiSlot": "command.palette", "operation": "vocal.prepare", "inputSchema": "vocal-preparation.v1"}
  ]
}
